{
  "cases": [
    {
      "advisory_relation": "exact_match",
      "classification": {
        "confidence": "high",
        "domain": "formal_news",
        "eligible": true,
        "notes": "句意可獨立判讀；依輸入語域與詞彙風險分類。",
        "quality_flags": [],
        "risk": "over_conversion_guard",
        "script": "simplified"
      },
      "id": "flores-200-zho-hans-v1/dev-0061",
      "selected_advisory": "codex"
    },
    {
      "advisory_relation": "exact_match",
      "classification": {
        "confidence": "high",
        "domain": "formal_news",
        "eligible": true,
        "notes": "句意可獨立判讀；依輸入語域與詞彙風險分類。",
        "quality_flags": [],
        "risk": "over_conversion_guard",
        "script": "simplified"
      },
      "id": "flores-200-zho-hans-v1/dev-0088",
      "selected_advisory": "codex"
    },
    {
      "advisory_relation": "disagreement",
      "classification": {
        "confidence": "high",
        "domain": "formal_news",
        "eligible": true,
        "notes": "句意可獨立判讀；依輸入語域與詞彙風險分類。",
        "quality_flags": [],
        "risk": "over_conversion_guard",
        "script": "simplified"
      },
      "id": "flores-200-zho-hans-v1/dev-0243",
      "selected_advisory": "codex"
    },
    {
      "advisory_relation": "disagreement",
      "classification": {
        "confidence": "high",
        "domain": "formal_news",
        "eligible": true,
        "notes": "句意可獨立判讀；依輸入語域與詞彙風險分類。",
        "quality_flags": [],
        "risk": "over_conversion_guard",
        "script": "simplified"
      },
      "id": "flores-200-zho-hans-v1/dev-0253",
      "selected_advisory": "codex"
    },
    {
      "advisory_relation": "exact_match",
      "classification": {
        "confidence": "high",
        "domain": "formal_news",
        "eligible": true,
        "notes": "句意可獨立判讀；依輸入語域與詞彙風險分類。",
        "quality_flags": [],
        "risk": "candidate_gap",
        "script": "simplified"
      },
      "id": "flores-200-zho-hans-v1/dev-0287",
      "selected_advisory": "codex"
    },
    {
      "advisory_relation": "disagreement",
      "classification": {
        "confidence": "high",
        "domain": "formal_news",
        "eligible": true,
        "notes": "句意可獨立判讀；依輸入語域與詞彙風險分類。",
        "quality_flags": [],
        "risk": "over_conversion_guard",
        "script": "simplified"
      },
      "id": "flores-200-zho-hans-v1/dev-0335",
      "selected_advisory": "codex"
    },
    {
      "advisory_relation": "exact_match",
      "classification": {
        "confidence": "high",
        "domain": "formal_news",
        "eligible": true,
        "notes": "句意可獨立判讀；依輸入語域與詞彙風險分類。",
        "quality_flags": [],
        "risk": "over_conversion_guard",
        "script": "simplified"
      },
      "id": "flores-200-zho-hans-v1/dev-0448",
      "selected_advisory": "codex"
    },
    {
      "advisory_relation": "exact_match",
      "classification": {
        "confidence": "high",
        "domain": "formal_news",
        "eligible": true,
        "notes": "句意可獨立判讀；依輸入語域與詞彙風險分類。",
        "quality_flags": [],
        "risk": "over_conversion_guard",
        "script": "simplified"
      },
      "id": "flores-200-zho-hans-v1/dev-0488",
      "selected_advisory": "codex"
    },
    {
      "advisory_relation": "disagreement",
      "classification": {
        "confidence": "high",
        "domain": "formal_news",
        "eligible": true,
        "notes": "句意可獨立判讀；依輸入語域與詞彙風險分類。",
        "quality_flags": [],
        "risk": "candidate_gap",
        "script": "simplified"
      },
      "id": "flores-200-zho-hans-v1/dev-0501",
      "selected_advisory": "codex"
    },
    {
      "advisory_relation": "exact_match",
      "classification": {
        "confidence": "high",
        "domain": "formal_news",
        "eligible": true,
        "notes": "句意可獨立判讀；依輸入語域與詞彙風險分類。",
        "quality_flags": [],
        "risk": "baseline_guard",
        "script": "simplified"
      },
      "id": "flores-200-zho-hans-v1/dev-0502",
      "selected_advisory": "codex"
    },
    {
      "advisory_relation": "exact_match",
      "classification": {
        "confidence": "high",
        "domain": "formal_news",
        "eligible": true,
        "notes": "句意可獨立判讀；依輸入語域與詞彙風險分類。",
        "quality_flags": [],
        "risk": "baseline_guard",
        "script": "simplified"
      },
      "id": "flores-200-zho-hans-v1/dev-0540",
      "selected_advisory": "codex"
    },
    {
      "advisory_relation": "exact_match",
      "classification": {
        "confidence": "high",
        "domain": "formal_news",
        "eligible": true,
        "notes": "句意可獨立判讀；依輸入語域與詞彙風險分類。",
        "quality_flags": [],
        "risk": "baseline_guard",
        "script": "simplified"
      },
      "id": "flores-200-zho-hans-v1/dev-0549",
      "selected_advisory": "codex"
    },
    {
      "advisory_relation": "exact_match",
      "classification": {
        "confidence": "medium",
        "domain": "social_daily",
        "eligible": true,
        "notes": "句意可獨立判讀；依輸入語域與詞彙風險分類。",
        "quality_flags": [
          "missing_terminal_punctuation"
        ],
        "risk": "baseline_guard",
        "script": "simplified"
      },
      "id": "flores-200-zho-hans-v1/dev-0588",
      "selected_advisory": "codex"
    },
    {
      "advisory_relation": "exact_match",
      "classification": {
        "confidence": "high",
        "domain": "formal_news",
        "eligible": true,
        "notes": "句意可獨立判讀；依輸入語域與詞彙風險分類。",
        "quality_flags": [],
        "risk": "candidate_gap",
        "script": "simplified"
      },
      "id": "flores-200-zho-hans-v1/dev-0626",
      "selected_advisory": "codex"
    },
    {
      "advisory_relation": "disagreement",
      "classification": {
        "confidence": "high",
        "domain": "social_daily",
        "eligible": true,
        "notes": "句意可獨立判讀；依輸入語域與詞彙風險分類。",
        "quality_flags": [],
        "risk": "baseline_guard",
        "script": "simplified"
      },
      "id": "flores-200-zho-hans-v1/dev-0659",
      "selected_advisory": "codex"
    },
    {
      "advisory_relation": "disagreement",
      "classification": {
        "confidence": "high",
        "domain": "formal_news",
        "eligible": true,
        "notes": "句意可獨立判讀；依輸入語域與詞彙風險分類。",
        "quality_flags": [],
        "risk": "baseline_guard",
        "script": "simplified"
      },
      "id": "flores-200-zho-hans-v1/dev-0660",
      "selected_advisory": "codex"
    },
    {
      "advisory_relation": "disagreement",
      "classification": {
        "confidence": "high",
        "domain": "social_daily",
        "eligible": true,
        "notes": "句意可獨立判讀；依輸入語域與詞彙風險分類。",
        "quality_flags": [],
        "risk": "candidate_gap",
        "script": "simplified"
      },
      "id": "flores-200-zho-hans-v1/dev-0672",
      "selected_advisory": "codex"
    },
    {
      "advisory_relation": "exact_match",
      "classification": {
        "confidence": "high",
        "domain": "formal_news",
        "eligible": true,
        "notes": "句意可獨立判讀；依輸入語域與詞彙風險分類。",
        "quality_flags": [],
        "risk": "baseline_guard",
        "script": "simplified"
      },
      "id": "flores-200-zho-hans-v1/dev-0701",
      "selected_advisory": "codex"
    },
    {
      "advisory_relation": "disagreement",
      "classification": {
        "confidence": "high",
        "domain": "social_daily",
        "eligible": true,
        "notes": "句意可獨立判讀；依輸入語域與詞彙風險分類。",
        "quality_flags": [],
        "risk": "over_conversion_guard",
        "script": "simplified"
      },
      "id": "flores-200-zho-hans-v1/dev-0772",
      "selected_advisory": "codex"
    },
    {
      "advisory_relation": "disagreement",
      "classification": {
        "confidence": "high",
        "domain": null,
        "eligible": false,
        "notes": "輸入殘缺、語意不清或病句程度過高，不納入候選池。",
        "quality_flags": [
          "malformed_sentence"
        ],
        "risk": null,
        "script": "simplified"
      },
      "id": "flores-200-zho-hans-v1/dev-0775",
      "selected_advisory": "codex"
    },
    {
      "advisory_relation": "exact_match",
      "classification": {
        "confidence": "high",
        "domain": "formal_news",
        "eligible": true,
        "notes": "句意可獨立判讀；依輸入語域與詞彙風險分類。",
        "quality_flags": [],
        "risk": "candidate_gap",
        "script": "simplified"
      },
      "id": "flores-200-zho-hans-v1/dev-0845",
      "selected_advisory": "codex"
    },
    {
      "advisory_relation": "disagreement",
      "classification": {
        "confidence": "high",
        "domain": "high_stakes",
        "eligible": true,
        "notes": "句意可獨立判讀；依輸入語域與詞彙風險分類。",
        "quality_flags": [],
        "risk": "baseline_guard",
        "script": "simplified"
      },
      "id": "flores-200-zho-hans-v1/dev-0864",
      "selected_advisory": "codex"
    },
    {
      "advisory_relation": "disagreement",
      "classification": {
        "confidence": "high",
        "domain": "social_daily",
        "eligible": true,
        "notes": "句意可獨立判讀；依輸入語域與詞彙風險分類。",
        "quality_flags": [],
        "risk": "baseline_guard",
        "script": "simplified"
      },
      "id": "flores-200-zho-hans-v1/dev-0870",
      "selected_advisory": "codex"
    },
    {
      "advisory_relation": "disagreement",
      "classification": {
        "confidence": "high",
        "domain": "high_stakes",
        "eligible": true,
        "notes": "句意可獨立判讀；依輸入語域與詞彙風險分類。",
        "quality_flags": [],
        "risk": "candidate_gap",
        "script": "simplified"
      },
      "id": "flores-200-zho-hans-v1/dev-0877",
      "selected_advisory": "codex"
    },
    {
      "advisory_relation": "exact_match",
      "classification": {
        "confidence": "high",
        "domain": "formal_news",
        "eligible": true,
        "notes": "句意可獨立判讀；依輸入語域與詞彙風險分類。",
        "quality_flags": [],
        "risk": "over_conversion_guard",
        "script": "simplified"
      },